{
  "id": "asrt_750f2092932e47c4",
  "propositionId": "prop_67c33b4e1b7348a7",
  "documentId": "doc_a8b3f9165caba304",
  "owner": "hibi-dogfood",
  "ref": "2358ba7e4b5a89c53310936962ac481c9084edf4",
  "anchor": {
    "doc": {
      "file": "plugins/hibi-cli/skills/hibi/references/cli-reference.md",
      "selectors": [
        {
          "kind": "text-quote",
          "exact": "≥ 0.9 similar",
          "prefix": "red value changed but the located text is still\n",
          "suffix": "; fewer than two resolving selectors forces `orp"
        },
        {
          "kind": "text-position",
          "start": 10513,
          "end": 10526
        }
      ]
    },
    "code": [
      {
        "file": "src/algo/params.ts",
        "selectors": [
          {
            "kind": "text-quote",
            "exact": "VALUE_VETO_TEXTQUOTE_SIMILARITY = 0.9",
            "prefix": "this and value changed (§17.3). */\nexport const ",
            "suffix": ";\nexport const VALUE_VETO_CONFIDENCE = 0.3;\n\n/**"
          },
          {
            "kind": "text-position",
            "start": 1822,
            "end": 1859
          },
          {
            "kind": "ast-node",
            "language": "typescript",
            "nodeType": "variable_declarator",
            "structuralHash": "de0dbd0a8e84411f",
            "semanticHash": "ae60bcabc637dddb"
          },
          {
            "kind": "value",
            "language": "typescript",
            "nodeKind": "number",
            "value": "0.9"
          }
        ]
      }
    ]
  },
  "enforcement": "retired",
  "verified": true,
  "verifiers": [],
  "attrs": {}
}
