{
  "id": "asrt_61a2a0cea2f24b19",
  "propositionId": "prop_4c165e8d74844830",
  "documentId": "doc_84263e2579006d07",
  "owner": "hibi-dogfood",
  "ref": "2358ba7e4b5a89c53310936962ac481c9084edf4",
  "anchor": {
    "doc": {
      "file": "docs/anchors.mdx",
      "selectors": [
        {
          "kind": "text-quote",
          "exact": "Structural-only AST matches score 0.40",
          "prefix": "`ambiguous`.\n  </Accordion>\n  <Accordion title=\"",
          "suffix": "\">\n    If the `ast-node` matches only structural"
        },
        {
          "kind": "text-position",
          "start": 6216,
          "end": 6254
        }
      ]
    },
    "code": [
      {
        "file": "src/algo/params.ts",
        "selectors": [
          {
            "kind": "text-quote",
            "exact": "STRUCTURAL_ONLY_SCORE = 0.4",
            "prefix": "its this partial score (§17.3). */\nexport const ",
            "suffix": ";\n\n/** Value veto trips when text-quote similari"
          },
          {
            "kind": "text-position",
            "start": 1691,
            "end": 1718
          },
          {
            "kind": "ast-node",
            "language": "typescript",
            "nodeType": "variable_declarator",
            "structuralHash": "de0dbd0a8e84411f",
            "semanticHash": "26a21c7f8401be2e"
          },
          {
            "kind": "value",
            "language": "typescript",
            "nodeKind": "number",
            "value": "0.4"
          }
        ]
      }
    ]
  },
  "enforcement": "retired",
  "verified": true,
  "verifiers": [],
  "attrs": {}
}
