{
  "id": "asrt_603e86ab9e5d418d",
  "propositionId": "prop_9118eeb1704b4b72",
  "documentId": "doc_84263e2579006d07",
  "owner": "hibi-dogfood",
  "ref": "ce2fd982a55dec0d80e48b0f06762adefd7e5bfb",
  "anchor": {
    "doc": {
      "file": "docs/anchors.mdx",
      "selectors": [
        {
          "kind": "text-quote",
          "exact": "within the error budget `min(256, floor(len × 0.4))`",
          "prefix": "y when its edit distance to the stored quote is ",
          "suffix": ", where `len` is the quote length. A candidate o"
        },
        {
          "kind": "text-position",
          "start": 2376,
          "end": 2428
        }
      ]
    },
    "code": [
      {
        "file": "src/algo/params.ts",
        "selectors": [
          {
            "kind": "text-quote",
            "exact": "FUZZY_ERROR_RATIO = 0.4",
            "prefix": "ted as not found (`orphaned`).\n */\nexport const ",
            "suffix": ";\nexport const FUZZY_ERROR_CAP = 256;\n\nexport fu"
          },
          {
            "kind": "text-position",
            "start": 661,
            "end": 684
          },
          {
            "kind": "ast-node",
            "language": "typescript",
            "nodeType": "variable_declarator",
            "structuralHash": "de0dbd0a8e84411f",
            "semanticHash": "9a737264d0fc381c"
          },
          {
            "kind": "value",
            "language": "typescript",
            "nodeKind": "number",
            "value": "0.4"
          }
        ]
      }
    ]
  },
  "enforcement": "enforced",
  "verified": true,
  "verifiers": [],
  "attrs": {}
}
