{
  "id": "asrt_eea1699940ec43f5",
  "propositionId": "prop_4cbd2f4edbfc42fc",
  "documentId": "doc_320b0ba63f0f3f7e",
  "owner": "hibi-dogfood",
  "ref": "c6d6f814de247673c6814bec90c119ae27914497",
  "anchor": {
    "doc": {
      "file": "docs/behavioral.mdx",
      "selectors": [
        {
          "kind": "text-quote",
          "exact": "The change-gate is the heart of Tier 3.",
          "prefix": "shows `behavior` as `n/a`.\n\n## The change-gate\n\n",
          "suffix": " It answers one question: *should this\nbehaviora"
        },
        {
          "kind": "text-position",
          "start": 4937,
          "end": 4976
        }
      ]
    },
    "code": [
      {
        "file": "src/algo/resolve.ts",
        "selectors": [
          {
            "kind": "text-quote",
            "exact": "function computeBehaviorRisk(",
            "prefix": "nchored-node signal, never flag every path.\n */\n",
            "suffix": "\n  assertion: Assertion,\n  codeChanged: ChangedE"
          },
          {
            "kind": "text-position",
            "start": 4063,
            "end": 4092
          },
          {
            "kind": "ast-node",
            "language": "typescript",
            "nodeType": "function_declaration",
            "structuralHash": "ff1b0a1b103063ed",
            "semanticHash": "8e239f8535473f87"
          },
          {
            "kind": "value",
            "language": "typescript",
            "nodeKind": "null",
            "value": "null"
          }
        ]
      }
    ]
  },
  "enforcement": "retired",
  "verified": true,
  "verifiers": [
    {
      "kind": "command",
      "ref": "bun test test/behavioral-gate.test.ts"
    }
  ],
  "attrs": {}
}
