{
  "id": "asrt_11109d361a134571",
  "propositionId": "prop_7f80b7d1d5f34292",
  "documentId": "doc_fa1698bd5b6313a3",
  "owner": "hibi-dogfood",
  "ref": "c6bac8d38ea9468d696bf29754ef9ba6e2871b1b",
  "anchor": {
    "doc": {
      "file": "docs/banners.mdx",
      "selectors": [
        {
          "kind": "text-quote",
          "exact": "The **headline** is `STALE DOCUMENT — N suspect claim(s) — re-verify before trusting.`",
          "prefix": " uses a different nonce and is never matched.\n- ",
          "suffix": " where `N` counts the body lines. A document who"
        },
        {
          "kind": "text-position",
          "start": 1360,
          "end": 1446
        }
      ]
    },
    "code": [
      {
        "file": "src/banner/banner.ts",
        "selectors": [
          {
            "kind": "text-quote",
            "exact": "`STALE DOCUMENT — ${n} suspect claim(s) — re-verify before trusting.`",
            "prefix": "xport const DEFAULT_HEADLINE = (n: number) =>\n  ",
            "suffix": ";\n\n/** Instruction files that get the compact si"
          },
          {
            "kind": "text-position",
            "start": 747,
            "end": 816
          },
          {
            "kind": "ast-node",
            "language": "typescript",
            "nodeType": "template_string",
            "structuralHash": "10bbebd9c537d746",
            "semanticHash": "ca0b35079d450469"
          }
        ]
      }
    ]
  },
  "enforcement": "enforced",
  "verified": true,
  "verifiers": [],
  "attrs": {}
}
